{
  "report_type": "graph_enhanced_comparison",
  "generated_at": "2026-09-01T19:10:17.651730+00:00",
  "config": {
    "embedding_model": "BAAI/bge-m3",
    "reranker_model": "BAAI/bge-reranker-v2-m3",
    "hybrid_collection": "chunks_hybrid_bge-m3_v1",
    "fusion_algorithm": "rrf",
    "dataset_path": "D:\\Project_new\\docsToCode\\eval\\eval_dataset.json",
    "num_queries": 37,
    "structural_subset_size": 7,
    "graph_candidate_budget": 10,
    "graph_total_timeout_ms": 30000
  },
  "baseline_metrics": {
    "recall_at_k": {
      "mean": 0.973,
      "min": 0.0,
      "max": 1.0
    },
    "mrr": {
      "mean": 0.8748,
      "min": 0.0,
      "max": 1.0
    },
    "ndcg_at_k": {
      "mean": 0.8994,
      "min": 0.0,
      "max": 1.0
    },
    "latency_ms": {
      "p50": 171.48,
      "p95": 227.22,
      "mean": 179.1,
      "min": 110.05,
      "max": 235.62
    }
  },
  "graph_metrics": {
    "recall_at_k": {
      "mean": 0.9459,
      "min": 0.0,
      "max": 1.0
    },
    "mrr": {
      "mean": 0.8964,
      "min": 0.0,
      "max": 1.0
    },
    "ndcg_at_k": {
      "mean": 0.906,
      "min": 0.0,
      "max": 1.0
    },
    "latency_ms": {
      "p50": 181.34,
      "p95": 243.35,
      "mean": 189.46,
      "min": 111.55,
      "max": 246.26
    }
  },
  "structural_subset_metrics": {
    "baseline_mrr_mean": 0.7381,
    "graph_mrr_mean": 0.8571,
    "mrr_relative_improvement": 16.122476629183037,
    "baseline_ndcg_mean": 0.8044,
    "graph_ndcg_mean": 0.8946,
    "ndcg_relative_improvement": 11.213326703132763,
    "recall_at_k_non_decreasing": true
  },
  "deltas": {
    "mrr_mean_delta": 0.021599999999999953,
    "ndcg_mean_delta": 0.00660000000000005,
    "recall_mean_delta": -0.027100000000000013,
    "latency_p50_delta_ms": 9.860000000000014,
    "latency_p95_delta_ms": 16.129999999999995
  },
  "hard_constraints": {
    "cross_project_leakage_events": 0,
    "schema_validity_rate": 1.0,
    "source_locatability_rate": 1.0,
    "all_passed": true
  },
  "three_gate_pass": {
    "sc001_structural_improvement": true,
    "sc002_001_noninferior": true,
    "sc013_002_nonstructural_noninferior": true,
    "hard_constraints_passed": true,
    "all_passed": true
  },
  "per_query_comparison": [
    {
      "query_index": 0,
      "query": "Find the definition of com.example.service.UserService.",
      "is_structural_benefit": false,
      "project_scope": "351193748123680768",
      "expected_evidence_ids": [
        "352016027946582016"
      ],
      "baseline_rank": 1,
      "graph_rank": 1,
      "baseline_dense_score": 0.5638318,
      "baseline_sparse_score": 10.464549,
      "baseline_fused_score": 0.03278688524590164,
      "baseline_rerank_score": 0.03278688524590164,
      "graph_dense_score": 0.5638318,
      "graph_sparse_score": 10.464549,
      "graph_recall_structure_weight": null,
      "graph_recall_hop_count": null,
      "graph_edge_path_summary": [],
      "graph_fused_score": 0.03278688524590164,
      "graph_rerank_score": 0.03278688524590164,
      "rank_improved": false
    },
    {
      "query_index": 1,
      "query": "What is the purpose of com.example.service.UserService#DB_PASSWORD?",
      "is_structural_benefit": false,
      "project_scope": "351193748123680768",
      "expected_evidence_ids": [
        "352016027946582017"
      ],
      "baseline_rank": 1,
      "graph_rank": 1,
      "baseline_dense_score": 0.63132393,
      "baseline_sparse_score": 60.69374,
      "baseline_fused_score": 0.03278688524590164,
      "baseline_rerank_score": 0.03278688524590164,
      "graph_dense_score": 0.63132393,
      "graph_sparse_score": 60.69374,
      "graph_recall_structure_weight": null,
      "graph_recall_hop_count": null,
      "graph_edge_path_summary": [],
      "graph_fused_score": 0.03278688524590164,
      "graph_rerank_score": 0.03278688524590164,
      "rank_improved": false
    },
    {
      "query_index": 2,
      "query": "Show me the implementation of com.example.service.UserService#repository.",
      "is_structural_benefit": false,
      "project_scope": "351193748123680768",
      "expected_evidence_ids": [
        "352016027946582018"
      ],
      "baseline_rank": 1,
      "graph_rank": 1,
      "baseline_dense_score": 0.6369271,
      "baseline_sparse_score": 46.971527,
      "baseline_fused_score": 0.03278688524590164,
      "baseline_rerank_score": 0.03278688524590164,
      "graph_dense_score": 0.6369271,
      "graph_sparse_score": 46.971527,
      "graph_recall_structure_weight": null,
      "graph_recall_hop_count": null,
      "graph_edge_path_summary": [],
      "graph_fused_score": 0.03278688524590164,
      "graph_rerank_score": 0.03278688524590164,
      "rank_improved": false
    },
    {
      "query_index": 3,
      "query": "What does com.example.service.UserService#findById do?",
      "is_structural_benefit": false,
      "project_scope": "351193748123680768",
      "expected_evidence_ids": [
        "352016027946582019"
      ],
      "baseline_rank": 1,
      "graph_rank": 1,
      "baseline_dense_score": 0.6522032,
      "baseline_sparse_score": 56.632202,
      "baseline_fused_score": 0.03278688524590164,
      "baseline_rerank_score": 0.03278688524590164,
      "graph_dense_score": 0.6522032,
      "graph_sparse_score": 56.632202,
      "graph_recall_structure_weight": null,
      "graph_recall_hop_count": null,
      "graph_edge_path_summary": [],
      "graph_fused_score": 0.03278688524590164,
      "graph_rerank_score": 0.03278688524590164,
      "rank_improved": false
    },
    {
      "query_index": 4,
      "query": "Explain the code at com.example.service.UserService#getActiveUsers.",
      "is_structural_benefit": false,
      "project_scope": "351193748123680768",
      "expected_evidence_ids": [
        "352016027946582020"
      ],
      "baseline_rank": 1,
      "graph_rank": 1,
      "baseline_dense_score": 0.7410897,
      "baseline_sparse_score": 42.948647,
      "baseline_fused_score": 0.03278688524590164,
      "baseline_rerank_score": 0.03278688524590164,
      "graph_dense_score": 0.7410897,
      "graph_sparse_score": 42.948647,
      "graph_recall_structure_weight": null,
      "graph_recall_hop_count": null,
      "graph_edge_path_summary": [],
      "graph_fused_score": 0.03278688524590164,
      "graph_rerank_score": 0.03278688524590164,
      "rank_improved": false
    },
    {
      "query_index": 5,
      "query": "Find the definition of com.example.service.UserService#validateToken.",
      "is_structural_benefit": false,
      "project_scope": "351193748123680768",
      "expected_evidence_ids": [
        "352016027946582021"
      ],
      "baseline_rank": 2,
      "graph_rank": 2,
      "baseline_dense_score": 0.6132928,
      "baseline_sparse_score": 2.2486122,
      "baseline_fused_score": 0.03225806451612903,
      "baseline_rerank_score": 0.03225806451612903,
      "graph_dense_score": 0.6132928,
      "graph_sparse_score": 2.2486122,
      "graph_recall_structure_weight": null,
      "graph_recall_hop_count": null,
      "graph_edge_path_summary": [],
      "graph_fused_score": 0.03225806451612903,
      "graph_rerank_score": 0.03225806451612903,
      "rank_improved": false
    },
    {
      "query_index": 6,
      "query": "Show me the section # extra.",
      "is_structural_benefit": false,
      "project_scope": "351207349697904640",
      "expected_evidence_ids": [
        "352016115179716608"
      ],
      "baseline_rank": 1,
      "graph_rank": 1,
      "baseline_dense_score": 0.7660171,
      "baseline_sparse_score": 136.65898,
      "baseline_fused_score": 0.03278688524590164,
      "baseline_rerank_score": 0.03278688524590164,
      "graph_dense_score": 0.7660171,
      "graph_sparse_score": 136.65898,
      "graph_recall_structure_weight": null,
      "graph_recall_hop_count": null,
      "graph_edge_path_summary": [],
      "graph_fused_score": 0.03278688524590164,
      "graph_rerank_score": 0.03278688524590164,
      "rank_improved": false
    },
    {
      "query_index": 7,
      "query": "Show me the section # Test Content.",
      "is_structural_benefit": false,
      "project_scope": "351221148429582336",
      "expected_evidence_ids": [
        "352016116299595776"
      ],
      "baseline_rank": 1,
      "graph_rank": 1,
      "baseline_dense_score": 0.6973518,
      "baseline_sparse_score": 60.67908,
      "baseline_fused_score": 0.03278688524590164,
      "baseline_rerank_score": 0.03278688524590164,
      "graph_dense_score": 0.6973518,
      "graph_sparse_score": 60.67908,
      "graph_recall_structure_weight": null,
      "graph_recall_hop_count": null,
      "graph_edge_path_summary": [],
      "graph_fused_score": 0.03278688524590164,
      "graph_rerank_score": 0.03278688524590164,
      "rank_improved": false
    },
    {
      "query_index": 8,
      "query": "Explain the content of # Test Content.",
      "is_structural_benefit": false,
      "project_scope": "351222351527936000",
      "expected_evidence_ids": [
        "352016117394309120"
      ],
      "baseline_rank": 1,
      "graph_rank": 1,
      "baseline_dense_score": 0.7158759,
      "baseline_sparse_score": 60.67908,
      "baseline_fused_score": 0.03278688524590164,
      "baseline_rerank_score": 0.03278688524590164,
      "graph_dense_score": 0.7158759,
      "graph_sparse_score": 60.67908,
      "graph_recall_structure_weight": null,
      "graph_recall_hop_count": null,
      "graph_edge_path_summary": [],
      "graph_fused_score": 0.03278688524590164,
      "graph_rerank_score": 0.03278688524590164,
      "rank_improved": false
    },
    {
      "query_index": 9,
      "query": "What does # Test Content describe?",
      "is_structural_benefit": false,
      "project_scope": "351222576757866496",
      "expected_evidence_ids": [
        "352016118451273728"
      ],
      "baseline_rank": 1,
      "graph_rank": 1,
      "baseline_dense_score": 0.6359798,